[
  {
    "id": "nod-krai-offering-hunters-cabin",
    "kind": "offering-system",
    "title": "巡猎者木屋·聚所共建（1-5级）",
    "settlement": { "id": "hunters-cabin", "name": "巡猎者木屋", "kind": "聚所" },
    "countryId": "snezhnaya",
    "areaId": "nod-krai",
    "regionId": "snezhnaya",
    "versionIntroduced": "7.0",
    "rewards": { "primogems": 250, "intertwinedFates": 0, "acquaintFates": 0, "other": ["每级 50 原石", "当前上限 5 级"] },
    "rewardMethod": "indirect-offering",
    "offeringCurrency": "徽印",
    "estimatedMinutes": { "min": 5, "typical": 10, "max": 15 },
    "difficulty": "easy",
    "completionGranularity": "resource",
    "prerequisiteIds": ["nod-krai-wq-hunters-cabin"],
    "guideLinks": [],
    "verification": { "status": "confirmed", "evidenceIds": ["ev-nod-krai-007"], "checkedAt": "2026-08-24", "note": "每级 50 原石，当前可升至 5 级，满级共 250 原石。" }
  },
  {
    "id": "nod-krai-offering-tide-song-cave",
    "kind": "offering-system",
    "title": "汐歌洞窟·聚所共建（1-5级）",
    "settlement": { "id": "tide-song-cave", "name": "汐歌洞窟", "kind": "聚所" },
    "countryId": "snezhnaya",
    "areaId": "nod-krai",
    "regionId": "snezhnaya",
    "versionIntroduced": "7.0",
    "rewards": { "primogems": 250, "intertwinedFates": 0, "acquaintFates": 0, "other": ["每级 50 原石", "当前上限 5 级"] },
    "rewardMethod": "indirect-offering",
    "offeringCurrency": "徽印",
    "estimatedMinutes": { "min": 5, "typical": 10, "max": 15 },
    "difficulty": "easy",
    "completionGranularity": "resource",
    "prerequisiteIds": ["nod-krai-wq-tide-song-cave"],
    "guideLinks": [],
    "verification": { "status": "confirmed", "evidenceIds": ["ev-nod-krai-007"], "checkedAt": "2026-08-24", "note": "每级 50 原石，当前可升至 5 级，满级共 250 原石。" }
  },
  {
    "id": "nod-krai-offering-korolevsky-theater",
    "kind": "offering-system",
    "title": "科洛列夫茨基剧院·聚所共建（1-5级）",
    "settlement": { "id": "korolevsky-theater", "name": "科洛列夫茨基剧院", "kind": "聚所" },
    "countryId": "snezhnaya",
    "areaId": "nod-krai",
    "regionId": "snezhnaya",
    "versionIntroduced": "7.0",
    "rewards": { "primogems": 250, "intertwinedFates": 0, "acquaintFates": 0, "other": ["每级 50 原石", "当前上限 5 级"] },
    "rewardMethod": "indirect-offering",
    "offeringCurrency": "徽印",
    "estimatedMinutes": { "min": 5, "typical": 10, "max": 15 },
    "difficulty": "easy",
    "completionGranularity": "resource",
    "prerequisiteIds": ["nod-krai-wq-theater"],
    "guideLinks": [],
    "verification": { "status": "confirmed", "evidenceIds": ["ev-nod-krai-007"], "checkedAt": "2026-08-24", "note": "每级 50 原石，当前可升至 5 级，满级共 250 原石。" }
  }
]
